{
  "accepted_in_principle_unchanged_from_v2": [
    {
      "canonical_sha256": "289c315c0fd9ce6a19bbd5922b3d62243c5d7645f96986ae5161b091cf42a3d1",
      "decision_id": "RD-002"
    },
    {
      "canonical_sha256": "a73f26aab5049e7ebed7e7890d07e2e46962a92590d45007d9d1da8920a2849a",
      "decision_id": "RD-003"
    },
    {
      "canonical_sha256": "52c662527f6b077fae6a1769e5889bf204b00fc4fbfa58bf6300eb0846ae5a76",
      "decision_id": "RD-004"
    },
    {
      "canonical_sha256": "8eeddc2bddc8de15d5338d4b0480b93ff7f0dc1b277c09f5e6f7c72431b38fe2",
      "decision_id": "RD-005"
    },
    {
      "canonical_sha256": "e3b3dde396ab6975329ef24d0c981f3ca39c0f3d08c3e5fee5db936354a2b698",
      "decision_id": "RD-006"
    },
    {
      "canonical_sha256": "4d757a8114fdbed1b73644c6f5eb14902282224262ea63ad909bb48bf2039793",
      "decision_id": "RD-008"
    },
    {
      "canonical_sha256": "486943c082d25e954453ab366300568437ddb58d2b46d37fd7f47663ec68ad1c",
      "decision_id": "RD-009"
    },
    {
      "canonical_sha256": "672b95dd80ce0a079eed3e4746d894cb280e38b15806d11814503e41290afd6c",
      "decision_id": "RD-010"
    },
    {
      "canonical_sha256": "5809fbb09bcfd88b9a4b73df23da71c90db61b0bc46360498cb2b03651f49d84",
      "decision_id": "RD-011"
    }
  ],
  "approval": {
    "approval_date": null,
    "approval_text": null,
    "approved_package_id": null,
    "dossier_sha256": null,
    "required_approver": "Alex",
    "status": "pending"
  },
  "approval_sentence_template": "I approve stage13-package-a-protected-core-optional-five-task/v3 exactly as described in the Stage 13 v3 decision dossier with SHA-256 <DOSSIER_SHA256>; Parts C-H may proceed subject to the Stage 14 protected-core launch gate.",
  "authority_owner": "Alex",
  "benchmark_evidence": {
    "classification": "constructed non-scientific evidence",
    "file_sha256": "fca4f4d7915a36fb18e82e34159d53ad67708e34d4505c74d194987617a37ced",
    "hard_concrete_profile": "516 components, 5000 steps, checkpoint every 50, retention 2; median 2623.751 native steps/s",
    "ordinary_restart_profile": "16 restarts, 256 exact allowance including intact; median 0.667390 s for bridge mechanics",
    "path": "followup/benchmarks/stage13_search_profile_benchmark_v1.json",
    "scope_limit": "does not benchmark model forward/backward work, CUDA, or campaign concurrency"
  },
  "created_date": "2026-08-31",
  "decisions": [
    {
      "amendment_consequence": "Changing seeds, task formula, or matched rule after approval requires a prospective amendment before Stage 15 and invalidates all affected manifest hashes.",
      "decision_id": "RD-001",
      "downstream_consequences": [
        "population sample size",
        "teacher and student job counts",
        "paired phase estimands",
        "explicit unavailable-cell accounting"
      ],
      "invalid_options": [
        "replace an unavailable seed after seeing circuit endpoints",
        "impute a missing phase",
        "treat the historical 15-cell Stage 3 roster as the new answer",
        "choose Task 3 from outcome direction"
      ],
      "protected_tier_consequences": {
        "tier1": "Task 1 uses exactly seeds 0-14 and the accepted three phases, with no replacement.",
        "tier2": "Task 2 modular multiplication uses seeds 0-4, pre/stable phases, and remains protected launch scope.",
        "tier3": "Tasks 3-5 are optional ordered increments, each seeds 0-4, pre/stable, direct plus lowest eligible hard/soft, canonical architecture/basis, both methods."
      },
      "question": "Which teachers, tasks, phases, and matched-primary inclusion rule define the population?",
      "rationale": "The protected population remains the fixed Package A seed roster. Tasks 3-5 add algebraically predeclared breadth only after protected security and cannot affect the launch estimand or replace failures.",
      "recommendation": {
        "matched_primary_rule": "teacher seed must have both primary phase landmarks; the 50% cell may be absent without invalidating the primary pair",
        "option": "A",
        "optional_task_common_panel": {
          "architecture": "canonical",
          "basis": "canonical",
          "discovery_methods": [
            "greedy-deletion-centred-logit/v1",
            "hard-concrete-gates-centred-logit/v1"
          ],
          "model_roles": [
            "direct teacher",
            "lowest eligible hard student",
            "lowest eligible soft student"
          ],
          "phases": [
            "pre-grokking",
            "stable post-grokking"
          ],
          "population_interpretation": "tasks are not independent population replicates; report task-indexed descriptive external validity",
          "replacement": "none",
          "tasks": [
            3,
            4,
            5
          ],
          "teacher_seeds": [
            0,
            1,
            2,
            3,
            4
          ]
        },
        "package_c_phase_complete_selection": "prohibited",
        "phase_rule": "historical-stage3-phase-selection/stage3-frozen/v1 using training metrics only",
        "phases": [
          "pre-grokking",
          "50%",
          "stable post-grokking"
        ],
        "primary_phase_contrast": [
          "pre-grokking",
          "stable post-grokking"
        ],
        "replacement_rule": "no replacement of task, teacher seed, phase, or failed training/student slot beyond its existing fixed cap",
        "task1": {
          "domain": "full 113x113",
          "family": "modular_addition",
          "modulus": 113
        },
        "task2": {
          "domain": "full 59x59",
          "family": "modular_multiplication",
          "modulus": 59,
          "role": "protected Tier 2 external validity"
        },
        "task3": {
          "domain": "full 59x59",
          "family": "modular_polynomial",
          "formula": "(x^2 + x*y + y^2) mod 59",
          "manifest": {
            "dataset_sha256": "674dc5807374a2da8da3732eb3224e15959e24e946fd6945122d7c0e6e41b6ae",
            "file_sha256": "b8797e72cceec09c5be3e1870dab9909c4140fc4e08df9ed4e76050cff9b88ff",
            "path": "followup/manifests/stage13_optional_tasks/task3_increment_v1.json",
            "sidecar_path": "followup/manifests/stage13_optional_tasks/task3_increment_v1.json.sha256",
            "task_config_sha256": "b1696fb0be4c7da5cc6f171bdc915a8c73f0e57f8d35150359cf8fe7c6b8281d",
            "task_identity_sha256": "df5e9285cd2c9985ae2866282d534f738b598e3caf13bdc14dc84828360733eb"
          },
          "modulus": 59,
          "optional_order": 1,
          "role": "optional Tier 3",
          "task_id": "stage13-task3-symmetric-quadratic-m59/v1"
        },
        "task4": {
          "domain": "full 59x59",
          "family": "modular_polynomial",
          "formula": "(x^3 + y^2) mod 59",
          "justification": "an asymmetric separable polynomial with unequal degrees and no interaction term; unlike subtraction, it is not a linear relabelling of Task 1, and unlike Task 2/3 it is neither bilinear nor homogeneous quadratic",
          "manifest": {
            "dataset_sha256": "0aad6a608e7aa1ca712487ec70db60674356b15ee29e6994cb2571c2b8440837",
            "file_sha256": "7490e47485204d82745f2bda47acd6d3ca37c28e85c153e82694bcbdf53c4758",
            "path": "followup/manifests/stage13_optional_tasks/task4_increment_v1.json",
            "sidecar_path": "followup/manifests/stage13_optional_tasks/task4_increment_v1.json.sha256",
            "task_config_sha256": "1192f07c9318964861556916ad71daf06b6662b1ecdc875d1a09045facd1868d",
            "task_identity_sha256": "fef2f01e151ce8324f149acee17e5d5d7f9038db65e4e9c3a20d226ca7d6bc86"
          },
          "modulus": 59,
          "optional_order": 2,
          "role": "optional Tier 3",
          "task_id": "stage13-task4-asymmetric-separable-mixed-degree-m59/v1"
        },
        "task5": {
          "domain": "full 59x59",
          "family": "modular_polynomial",
          "formula": "(x^2*y + x*y^2) mod 59 = x*y*(x+y) mod 59",
          "justification": "a homogeneous degree-3 coupled interaction with no pure monomials; it differs from separable Task 4, degree-2 Task 3, and single-monomial multiplication",
          "manifest": {
            "dataset_sha256": "3b664b5e50bb6ce09c02cff307a8f42e3e274da1be427910075518a01ef4e63c",
            "file_sha256": "cf784b526eb801c8a6032cc0addb45c8376190139e5a324c9c37d9c0db6e1b87",
            "path": "followup/manifests/stage13_optional_tasks/task5_increment_v1.json",
            "sidecar_path": "followup/manifests/stage13_optional_tasks/task5_increment_v1.json.sha256",
            "task_config_sha256": "ef35a64422e444383477c75c8ce9c6526ce1bb831b76e9297b83b098c79c7ca9",
            "task_identity_sha256": "59ee026362f1a21e991cb4c5957b60b23d320847d01f0e613f74434e5620a619"
          },
          "modulus": 59,
          "optional_order": 3,
          "role": "optional Tier 3",
          "task_id": "stage13-task5-coupled-homogeneous-cubic-m59/v1"
        },
        "teacher_seeds": [
          0,
          1,
          2,
          3,
          4,
          5,
          6,
          7,
          8,
          9,
          10,
          11,
          12,
          13,
          14
        ],
        "teacher_training": "canonical predecessor architecture and configs/model.yaml plus configs/training.yaml, trained from scratch for at most 40000 updates"
      },
      "requires_alex_choice": true,
      "stage11_direction": "Expand beyond five predecessor seeds toward approximately fifteen; Task 1 is protected mod-113 addition, Task 2 is reduced multiplication, and Task 3 is capacity-contingent polynomial breadth.",
      "stage12_evidence": "P1 can construct all three task families, train/resume teachers, apply the historical metric-only phase rule, and emit unavailable cells without scientific execution.",